{
  "mode": "verify",
  "task": "Validate fixture implementation parity",
  "success_criteria": [
    "All sources readable",
    "No divergence in fixture outputs"
  ],
  "sources_used": [
    "[codex:codex-fi] /home/user/agent-chorus/fixtures/session-store/codex/sessions/2026/01/01/session-codex-fixture-0001.jsonl",
    "[gemini:gemini-f] /home/user/agent-chorus/fixtures/session-store/gemini/tmp/demo/chats/session-gemini-fixture-0001.json",
    "[claude:claude-f] /home/user/agent-chorus/fixtures/session-store/claude/projects/sample/session-claude-fixture-0001.jsonl"
  ],
  "verdict": "FAIL",
  "findings": [
    {
      "severity": "P2",
      "summary": "Agent outputs partially overlap (similarity: 60%)",
      "detail": "codex ↔ gemini: 60%, codex ↔ claude: 60%, gemini ↔ claude: 60%",
      "evidence": [
        "[codex:codex-fi]",
        "[gemini:gemini-f]",
        "[claude:claude-f]"
      ],
      "confidence": 0.7
    }
  ],
  "recommended_next_actions": [
    "Inspect full transcripts for diverging sources before final decisions.",
    "Verify recommendations against constraints: No cloud dependencies; Keep output concise."
  ],
  "open_questions": []
}
